{"metric_contract":{"status":"No current task admitted; multi-estimator validation remains future"},"protocol_version":"domains.bank.v0.1","purpose":"candidate_low_structural_dependence","schema_version":1,"selection_basis":"qualification evidence fixed before evaluation of a new estimator","suite_id":"10e76b7cfb19deb0de243246da0841daa90ea01b6978fe73f7cb1207d0eb1b7e","tasks":[]}
