{"metric_contract":{"metrics":"task-wise native RMSE/MAE/R2 in original units; no cross-target RMSE aggregation","uncertainty":"separate conditional OOF resampling and repeated fitted-design sensitivity; intended purpose is not an independence certificate"},"protocol_version":"domains.bank.v0.1","purpose":"transfer_challenge","schema_version":1,"selection_basis":"qualification evidence fixed before evaluation of a new estimator","suite_id":"97cd47cbe6791b0e8cf2218561e4ab39e7d12da9d57d55d44c622fbcc26b5e0b","tasks":[{"evidence_id":"e1ca3c65c758eefc2101fd5d8e67939964035672060bb73b2f7dca2a8bbff537","evidence_sha256":"27215e10dd3c86c82751a5465e7a0fb09bb418ad0944bd6634eb247b3a9aeb5b","split_protocol":"sealed_plot17; grouped_refits17_31_47; new-object preparation transfer","task_id":"6970c59c4d617e56353b2d84f33ea95d0ee52019ea2ab65276c64bff4da69f3f"}]}
