{"metric_contract":{"estimator_comparison_certified":false,"metric":"RMSE in each task's declared target unit; matched physical OOF IDs","split":"Frozen reference and named structural stress contrasts; never choose using a new estimator","target_access":"development outcomes only; retained Y_test sealed"},"protocol_version":"domains.bank.v0.1","purpose":"structure_sensitive_challenge","schema_version":1,"selection_basis":"qualification evidence fixed before evaluation of a new estimator","suite_id":"50978c72514aa8b5ebf01540c86c158f1a327708cb96d9829c5800880ed4c050","tasks":[{"evidence_id":"412f711feead1328d46c41d4a7d6ddb1e1ffcfd0164b7167ea53836a7cffcf9e","evidence_sha256":"f541c62dbb7d4fbc7e30e145c087eb97e2039b6a82d4d3d29f8ba399060462c4","split_protocol":"experimental_plot_sha256_v1; frozen grouped OOF and declared stress designs","task_id":"f1a30d3086e6aca919b68c2f53b50ae8fb684451d46959e96c15b52e583285f9"}]}
